<?xml version="1.0" encoding="UTF-8"?>
<tns:Configuration hierarchy="target" description="Trans-European Automated Real-time Gross settlement Express Transfer system closing dates" 
                   xmlns:tns="http://www.example.org/Holiday" 
                   xmlns:xsi="http://www.w3.org/2001/XMLSchema-instance" 
                   xsi:schemaLocation="http://www.example.org/Holiday /Holiday.xsd">
  <tns:Holidays>
      <tns:Fixed validFrom="2000" month="JANUARY" day="1" descriptionPropertiesKey="NEW_YEAR"/>
      <tns:Fixed validFrom="2000" month="MAY" day="1" descriptionPropertiesKey="LABOUR_DAY"/>
      <tns:Fixed validFrom="1999" month="DECEMBER" day="25" descriptionPropertiesKey="CHRISTMAS"/>
      <tns:Fixed validFrom="1999" month="DECEMBER" day="26" descriptionPropertiesKey="STEPHENS"/>
      <tns:Fixed validFrom="2001" validTo="2001" month="DECEMBER" day="31" descriptionPropertiesKey="NEW_YEARS_EVE"/>
      <tns:Fixed validFrom="1999" validTo="1999" month="DECEMBER" day="31" descriptionPropertiesKey="NEW_YEARS_EVE"/>
      <tns:ChristianHoliday validFrom="2000" type="GOOD_FRIDAY"/>
      <tns:ChristianHoliday validFrom="2000" type="EASTER_MONDAY"/>
  </tns:Holidays>
</tns:Configuration>
